### ISSUE TITLE
VLC did not play

### ISSUE THREAD

**Issue by 9000h** [catalinii/minisatip#18]
as we know VDR satip plugin and dvbviewer/DD-TV is working VLC is not unfortunatly

here are a log
 Starting minisatip version 0.1.3, dvbapi version: 0504
[Sun Jan 18 19:20:12.000 2015]: New UDP socket 3 bound to 0.0.0.0:1900
[Sun Jan 18 19:20:12.001 2015]: setting multicast for 239.255.255.250
[Sun Jan 18 19:20:12.001 2015]: New UDP socket 4 bound to 239.255.255.250:1900
[Sun Jan 18 19:20:12.001 2015]: New UDP socket 7 bound to 0.0.0.0:5500
[Sun Jan 18 19:20:12.001 2015]: New UDP socket 8 bound to 0.0.0.0:5501
[Sun Jan 18 19:20:12.001 2015]: sockets_add: handle 3 (type 0) returning socket index 0 [0.0.0.0:0]
[Sun Jan 18 19:20:12.001 2015]: sockets_add: handle 4 (type 0) returning socket index 1 [0.0.0.0:0]
[Sun Jan 18 19:20:12.001 2015]: sockets_add: handle 5 (type 2) returning socket index 2 [0.0.0.0:0]
[Sun Jan 18 19:20:12.001 2015]: sockets_add: handle 6 (type 2) returning socket index 3 [0.0.0.0:0]
[Sun Jan 18 19:20:12.001 2015]: starting init_hw 0
[Sun Jan 18 19:20:12.002 2015]: trying to open [0] adapter 0 and frontend 0
adapter.c:103 allocation_wrapper malloc returns 0x108ccf0
[Sun Jan 18 19:20:12.002 2015]: opened DVB adapter 0 fe:9 dvr:10
[Sun Jan 18 19:20:12.003 2015]: Done setting DVR buffer to 5775360 bytes
[Sun Jan 18 19:20:12.003 2015]: deleting pids on adapter 0, sid -1, pids=NULL
[Sun Jan 18 19:20:12.535 2015]: sockets_add: handle 10 (type 5) returning socket index 4 [0.0.0.0:0]
[Sun Jan 18 19:20:12.535 2015]: done opening adapter 0 fe_sys 1
[Sun Jan 18 19:20:12.535 2015]: trying to open [1] adapter 1 and frontend 0
adapter.c:103 allocation_wrapper malloc returns 0x108f100
[Sun Jan 18 19:20:12.535 2015]: opened DVB adapter 1 fe:11 dvr:12
[Sun Jan 18 19:20:12.536 2015]: Done setting DVR buffer to 5775360 bytes
[Sun Jan 18 19:20:12.536 2015]: deleting pids on adapter 1, sid -1, pids=NULL
[Sun Jan 18 19:20:12.591 2015]: sockets_add: handle 12 (type 5) returning socket index 5 [0.0.0.0:0]
[Sun Jan 18 19:20:12.591 2015]: done opening adapter 1 fe_sys 6
[Sun Jan 18 19:20:12.591 2015]: trying to open [2] adapter 2 and frontend 0
adapter.c:103 allocation_wrapper malloc returns 0x1091510
[Sun Jan 18 19:20:12.591 2015]: opened DVB adapter 2 fe:13 dvr:14
[Sun Jan 18 19:20:12.592 2015]: Done setting DVR buffer to 5775360 bytes
[Sun Jan 18 19:20:12.592 2015]: deleting pids on adapter 2, sid -1, pids=NULL
[Sun Jan 18 19:20:12.619 2015]: sockets_add: handle 14 (type 5) returning socket index 6 [0.0.0.0:0]
[Sun Jan 18 19:20:12.619 2015]: done opening adapter 2 fe_sys 16
[Sun Jan 18 19:20:12.619 2015]: done init_hw 1
Initializing with 3 devices
[Sun Jan 18 19:20:12.820 2015]: ssdp_discovery fd: 3 -> NOTIFY * HTTP/1.1
HOST: 239.255.255.250:1900
CACHE-CONTROL: max-age=1800
LOCATION: http://192.168.178.133:8080/desc.xml
NT: upnp:rootdevice
NTS: ssdp:alive 
SERVER: Linux/1.0 UPnP/1.1 IDL4K/1.2
USN: uuid:11223344-9999-0000-b7ae-0040caa2c79d::upnp:rootdevice
BOOTID.UPNP.ORG: 6
CONFIGID.UPNP.ORG: 0
DEVICEID.SES.COM: 9

[Sun Jan 18 19:20:21.438 2015]: sockets_add: handle 16 (type 1) returning socket index 7 [192.168.178.112:51086]
[Sun Jan 18 19:20:21.447 2015]: read RTSP (from handle 16 sock_id 7): OPTIONS rtsp://192.168.178.133:554/?freq=338.000&msys=dvbc&sr=6900&mtype=256qam&pids=0,100,101,104,102,103,106 RTSP/1.0
CSeq: 2
User-Agent: LibVLC/2.2.0-rc1 (LIVE555 Streaming Media v2014.07.25)

[Sun Jan 18 19:20:21.448 2015]: reply -> 16 (CL:0) :
RTSP/1.0 200 OK
Cseq: 2
Public: OPTIONS, DESCRIBE, SETUP, PLAY, TEARDOWN

[Sun Jan 18 19:20:21.449 2015]: read RTSP (from handle 16 sock_id 7): DESCRIBE rtsp://192.168.178.133:554/?freq=338.000&msys=dvbc&sr=6900&mtype=256qam&pids=0,100,101,104,102,103,106 RTSP/1.0
CSeq: 3
User-Agent: LibVLC/2.2.0-rc1 (LIVE555 Streaming Media v2014.07.25)
Accept: application/sdp

[Sun Jan 18 19:20:21.449 2015]: starting init_hw 1
[Sun Jan 18 19:20:21.449 2015]: starting init_hw 1
[Sun Jan 18 19:20:21.449 2015]: starting init_hw 1
[Sun Jan 18 19:20:21.449 2015]: reply -> 16 (CL:69) :
RTSP/1.0 200 OK
Cseq: 3
Public: OPTIONS, DESCRIBE, SETUP, PLAY, TEARDOWN
Content-Length: 69

v=0
o=--1 -1 IN IPV4 192.168.178.133
s=SatIPServer:1 1 1 1
t=0 0

[Sun Jan 18 19:20:21.451 2015]: select_and_execute[7]: Close on socket 16 (sid:-1) from 192.168.178.112:51086 - type rtsp failure 0:Success
[Sun Jan 18 19:20:21.451 2015]: sockets_del: 7 -> handle 16, sid -1
[Sun Jan 18 19:20:21.451 2015]: Closing stream -1
[Sun Jan 18 19:20:21.451 2015]: sockets_del: 7 Last open socket is at index 6 current_handle 16
[Sun Jan 18 19:20:21.451 2015]: Delete socket 7 done: sid -1
[Sun Jan 18 19:20:21.454 2015]: sockets_add: handle 16 (type 1) returning socket index 7 [192.168.178.112:51089]
[Sun Jan 18 19:20:21.454 2015]: read RTSP (from handle 16 sock_id 7): OPTIONS rtsp://192.168.178.133:554 RTSP/1.0

Not a complete request RTSP_request read_bytes=45 ends with: 2E300D0A
[Sun Jan 18 19:20:21.456 2015]: read RTSP (from handle 16 sock_id 7): CSeq: 1
User-Agent: RealMedia Player Version 6.0.9.1235 (linux-2.0-libc6-i386-gcc2.95)
ClientChallenge: 9e26d33f2984236010ef6253fb1887f7
PlayerStarttime: [28/03/2003:22:50:23 00:00]
CompanyID: KnKV4M4I/B2FjJ1TToLycw==
GUID: 00000000-0000-0000-0000-000000000000
RegionData: 0
ClientID: Linux_2.4_6.0.9.1235_play32_RN01_EN_586

[Sun Jan 18 19:20:41.394 2015]: select_and_execute[7]: Close on socket 16 (sid:-1) from 192.168.178.112:51089 - type rtsp failure 0:Success
[Sun Jan 18 19:20:41.394 2015]: sockets_del: 7 -> handle 16, sid -1
[Sun Jan 18 19:20:41.394 2015]: Closing stream -1
[Sun Jan 18 19:20:41.394 2015]: sockets_del: 7 Last open socket is at index 6 current_handle 16
[Sun Jan 18 19:20:41.394 2015]: Delete socket 7 done: sid -1
[Sun Jan 18 19:20:49.767 2015]: ssdp_reply fd: 3 -> 192.168.178.120
HTTP/1.1 200 OK
CACHE-CONTROL: max-age=1800
DATE: Sun Jan 18 19:20:49.767 2015
EXT:
LOCATION: http://192.168.178.133:8080/desc.xml
SERVER: Linux/1.0 UPnP/1.1 IDL4K/1.2
ST: urn:ses-com:device:SatIPServer:1
USN: uuid:11223344-9999-0000-b7ae-0040caa2c79d::urn:ses-com:device:SatIPServer:1
BOOTID.UPNP.ORG: 6
CONFIGID.UPNP.ORG: 0
DEVICEID.SES.COM: 9

[Sun Jan 18 19:20:49.767 2015]: ssdp_reply fd: 3 -> 192.168.178.120
HTTP/1.1 200 OK
CACHE-CONTROL: max-age=1800
DATE: Sun Jan 18 19:20:49.767 2015
EXT:
LOCATION: http://192.168.178.133:8080/desc.xml
SERVER: Linux/1.0 UPnP/1.1 IDL4K/1.2
ST: urn:ses-com:device:SatIPServer:1
USN: uuid:11223344-9999-0000-b7ae-0040caa2c79d::urn:ses-com:device:SatIPServer:1
BOOTID.UPNP.ORG: 6
CONFIGID.UPNP.ORG: 0
DEVICEID.SES.COM: 9

^Cselect_and_execute: select() error: Interrupted system call
[Sun Jan 18 19:20:50.807 2015]: sockets_del: 6 -> handle 14, sid 2
[Sun Jan 18 19:20:50.807 2015]: closing DVR socket -1 pos 6 aid 2
[Sun Jan 18 19:20:50.807 2015]: closing adapter 2  -> fe:13 dvr:14
[Sun Jan 18 19:20:50.807 2015]: deleting pids on adapter 2, sid -1, pids=NULL
[Sun Jan 18 19:20:50.807 2015]: sockets_del: 6 -> handle -1, sid 2
[Sun Jan 18 19:20:50.807 2015]: done closing adapter 2
[Sun Jan 18 19:20:50.808 2015]: sockets_del: 6 Last open socket is at index 5 current_handle 14
[Sun Jan 18 19:20:50.808 2015]: sockets_del: 5 -> handle 12, sid 1
[Sun Jan 18 19:20:50.808 2015]: closing DVR socket -1 pos 5 aid 1
[Sun Jan 18 19:20:50.808 2015]: closing adapter 1  -> fe:11 dvr:12
[Sun Jan 18 19:20:50.808 2015]: deleting pids on adapter 1, sid -1, pids=NULL
[Sun Jan 18 19:20:50.808 2015]: sockets_del: 5 -> handle -1, sid 1
[Sun Jan 18 19:20:50.808 2015]: done closing adapter 1
[Sun Jan 18 19:20:50.808 2015]: sockets_del: 5 Last open socket is at index 4 current_handle 12
[Sun Jan 18 19:20:50.808 2015]: sockets_del: 4 -> handle 10, sid 0
[Sun Jan 18 19:20:50.808 2015]: closing DVR socket -1 pos 4 aid 0
[Sun Jan 18 19:20:50.808 2015]: closing adapter 0  -> fe:9 dvr:10
[Sun Jan 18 19:20:50.808 2015]: deleting pids on adapter 0, sid -1, pids=NULL
[Sun Jan 18 19:20:50.808 2015]: sockets_del: 4 -> handle -1, sid 0
[Sun Jan 18 19:20:50.808 2015]: done closing adapter 0
[Sun Jan 18 19:20:50.809 2015]: sockets_del: 4 Last open socket is at index 3 current_handle 10
[Sun Jan 18 19:20:50.809 2015]: sockets_del: 3 -> handle 6, sid -1
[Sun Jan 18 19:20:50.809 2015]: sockets_del: 3 Last open socket is at index 2 current_handle 6
[Sun Jan 18 19:20:50.809 2015]: sockets_del: 2 -> handle 5, sid -1
[Sun Jan 18 19:20:50.809 2015]: sockets_del: 2 Last open socket is at index 1 current_handle 5
[Sun Jan 18 19:20:50.809 2015]: sockets_del: 1 -> handle 4, sid -1
[Sun Jan 18 19:20:50.809 2015]: sockets_del: 1 Last open socket is at index 0 current_handle 4
adapter.c:692 allocation_wrapper free called with argument 0x108ccf0 - done free
adapter.c:692 allocation_wrapper free called with argument 0x108f100 - done free
adapter.c:692 allocation_wrapper free called with argument 0x1091510 - done free
root@yavdr2:/usr/src/satip/minisatip-master#

**Comment by 9000h** [comment]
I did also try to use smplayer on Linux (the same request) but did also not work
smplayer "ffmpeg://rtsp://192.168.178.133:554/?freq=338.000&msys=dvbc&sr=6900&mtype=256qam&pids=0,100,101,104,102,103,106"

./minisatip -l -l -l -f
Starting minisatip version 0.1.3, dvbapi version: 0504
[Sun Jan 18 19:26:58.000 2015]: New UDP socket 3 bound to 0.0.0.0:1900
[Sun Jan 18 19:26:58.001 2015]: setting multicast for 239.255.255.250
[Sun Jan 18 19:26:58.001 2015]: New UDP socket 4 bound to 239.255.255.250:1900
[Sun Jan 18 19:26:58.001 2015]: New UDP socket 7 bound to 0.0.0.0:5500
[Sun Jan 18 19:26:58.001 2015]: New UDP socket 8 bound to 0.0.0.0:5501
[Sun Jan 18 19:26:58.001 2015]: sockets_add: handle 3 (type 0) returning socket index 0 [0.0.0.0:0]
[Sun Jan 18 19:26:58.001 2015]: sockets_add: handle 4 (type 0) returning socket index 1 [0.0.0.0:0]
[Sun Jan 18 19:26:58.001 2015]: sockets_add: handle 5 (type 2) returning socket index 2 [0.0.0.0:0]
[Sun Jan 18 19:26:58.001 2015]: sockets_add: handle 6 (type 2) returning socket index 3 [0.0.0.0:0]
[Sun Jan 18 19:26:58.001 2015]: starting init_hw 0
[Sun Jan 18 19:26:58.001 2015]: trying to open [0] adapter 0 and frontend 0
adapter.c:103 allocation_wrapper malloc returns 0x2176cf0
[Sun Jan 18 19:26:58.002 2015]: opened DVB adapter 0 fe:9 dvr:10
[Sun Jan 18 19:26:58.003 2015]: Done setting DVR buffer to 5775360 bytes
[Sun Jan 18 19:26:58.003 2015]: deleting pids on adapter 0, sid -1, pids=NULL
[Sun Jan 18 19:26:59.534 2015]: sockets_add: handle 10 (type 5) returning socket index 4 [0.0.0.0:0]
[Sun Jan 18 19:26:59.534 2015]: done opening adapter 0 fe_sys 1
[Sun Jan 18 19:26:59.534 2015]: trying to open [1] adapter 1 and frontend 0
adapter.c:103 allocation_wrapper malloc returns 0x2179100
[Sun Jan 18 19:26:59.534 2015]: opened DVB adapter 1 fe:11 dvr:12
[Sun Jan 18 19:26:59.535 2015]: Done setting DVR buffer to 5775360 bytes
[Sun Jan 18 19:26:59.535 2015]: deleting pids on adapter 1, sid -1, pids=NULL
[Sun Jan 18 19:26:59.590 2015]: sockets_add: handle 12 (type 5) returning socket index 5 [0.0.0.0:0]
[Sun Jan 18 19:26:59.590 2015]: done opening adapter 1 fe_sys 6
[Sun Jan 18 19:26:59.590 2015]: trying to open [2] adapter 2 and frontend 0
adapter.c:103 allocation_wrapper malloc returns 0x217b510
[Sun Jan 18 19:26:59.590 2015]: opened DVB adapter 2 fe:13 dvr:14
[Sun Jan 18 19:26:59.591 2015]: Done setting DVR buffer to 5775360 bytes
[Sun Jan 18 19:26:59.591 2015]: deleting pids on adapter 2, sid -1, pids=NULL
[Sun Jan 18 19:26:59.618 2015]: sockets_add: handle 14 (type 5) returning socket index 6 [0.0.0.0:0]
[Sun Jan 18 19:26:59.618 2015]: done opening adapter 2 fe_sys 16
[Sun Jan 18 19:26:59.618 2015]: done init_hw 1
Initializing with 3 devices
[Sun Jan 18 19:26:59.819 2015]: ssdp_discovery fd: 3 -> NOTIFY * HTTP/1.1
HOST: 239.255.255.250:1900
CACHE-CONTROL: max-age=1800
LOCATION: http://192.168.178.133:8080/desc.xml
NT: upnp:rootdevice
NTS: ssdp:alive 
SERVER: Linux/1.0 UPnP/1.1 IDL4K/1.2
USN: uuid:11223344-9999-0000-b7ae-0040caa2c79d::upnp:rootdevice
BOOTID.UPNP.ORG: 9
CONFIGID.UPNP.ORG: 0
DEVICEID.SES.COM: 9


[Sun Jan 18 19:27:06.623 2015]: sockets_add: handle 16 (type 1) returning socket index 7 [192.168.178.101:48264]
[Sun Jan 18 19:27:06.623 2015]: read RTSP (from handle 16 sock_id 7): OPTIONS rtsp://192.168.178.133:554/?freq=338.000&msys=dvbc&sr=6900&mtype=256qam&pids=0,100,101,104,102,103,106 RTSP/1.0
CSeq: 1


[Sun Jan 18 19:27:06.623 2015]: reply -> 16 (CL:0) :
RTSP/1.0 200 OK
Cseq: 1
Public: OPTIONS, DESCRIBE, SETUP, PLAY, TEARDOWN


[Sun Jan 18 19:27:06.623 2015]: read RTSP (from handle 16 sock_id 7): DESCRIBE rtsp://192.168.178.133:554/?freq=338.000&msys=dvbc&sr=6900&mtype=256qam&pids=0,100,101,104,102,103,106 RTSP/1.0
Accept: application/sdp
CSeq: 2


[Sun Jan 18 19:27:06.623 2015]: starting init_hw 1
[Sun Jan 18 19:27:06.623 2015]: starting init_hw 1
[Sun Jan 18 19:27:06.623 2015]: starting init_hw 1
[Sun Jan 18 19:27:06.623 2015]: reply -> 16 (CL:69) :
RTSP/1.0 200 OK
Cseq: 2
Public: OPTIONS, DESCRIBE, SETUP, PLAY, TEARDOWN
Content-Length: 69

v=0
o=--1 -1 IN IPV4 192.168.178.133
s=SatIPServer:1 1 1 1
t=0 0



[Sun Jan 18 19:27:06.624 2015]: read RTSP (from handle 16 sock_id 7): PLAY rtsp://192.168.178.133:554/?freq=338.000&msys=dvbc&sr=6900&mtype=256qam&pids=0,100,101,104,102,103,106 RTSP/1.0
Range: npt=0.000-
CSeq: 3


[Sun Jan 18 19:27:06.624 2015]: starting init_hw 1
[Sun Jan 18 19:27:06.624 2015]: detect_dvb_parameters (S)-> freq=338.000&msys=dvbc&sr=6900&mtype=256qam&pids=0,100,101,104,102,103,106
[Sun Jan 18 19:27:06.624 2015]: detect_dvb_parameters (E) -> src=-1, fe=-1, freq=338000, sr=6900000, pol=-1, ro=-1, msys=1, mtype=5, pltf=-1, bw=-1, inv=-1, pids=0,100,101,104,102,103,106 - apids=NULL - dpids=NULL
[Sun Jan 18 19:27:06.624 2015]: Setup stream -1 parameters, sock_id 7, handle 16
[Sun Jan 18 19:27:06.671 2015]: fill_sockaddr: gethostbyname(): Connection timed out
[Sun Jan 18 19:27:06.671 2015]: New UDP socket 17 connected to 0.0.0.0:0
stream.c:264 allocation_wrapper malloc returns 0x217fee0
stream.c:266 allocation_wrapper malloc returns 0x2180030
stream.c:268 allocation_wrapper malloc returns 0x2180180
stream.c:270 allocation_wrapper malloc returns 0x21802d0
[Sun Jan 18 19:27:06.671 2015]: copy_dvb_param start -> src=0, fe=0, freq=0, sr=0, pol=, ro=3, msys=0, mtype=0, pltf=2, bw=8000000, inv=2, pids=NULL, apids=NULL, dpids=NULL
[Sun Jan 18 19:27:06.671 2015]: copy_dvb_parameters -> src=0, fe=0, freq=338000, sr=6900000, pol=, ro=3, msys=1, mtype=5, pltf=2, bw=8000000, inv=2, pids=0,100,101,104,102,103,106, apids=NULL, dpids=NULL
[Sun Jan 18 19:27:06.671 2015]: Setup stream done: sid: 0 (e:1) for sock 7 handle 16
[Sun Jan 18 19:27:06.671 2015]: Play for stream 0, adapter -1, sock_id 7 handle 16
[Sun Jan 18 19:27:06.671 2015]: get free adapter -1 - a[0] => e:1 m:-1 sid_cnt:0 f:0

[Sun Jan 18 19:27:06.671 2015]: Got adapter 0 on socket 7
[Sun Jan 18 19:27:06.671 2015]: set adapter 0 for stream 0 m:0 s:1
[Sun Jan 18 19:27:06.671 2015]: setting DVB parameters for adapter 0 - master_sid 0 sid 0 old f:0
[Sun Jan 18 19:27:06.671 2015]: deleting pids on adapter 0, sid -1, pids=NULL
[Sun Jan 18 19:27:06.671 2015]: deleting pids on adapter 0, sid -1, pids=NULL
[Sun Jan 18 19:27:06.671 2015]: copy_dvb_param start -> src=0, fe=0, freq=0, sr=0, pol=, ro=3, msys=1, mtype=0, pltf=2, bw=8000000, inv=2, pids=NULL, apids=NULL, dpids=NULL
[Sun Jan 18 19:27:06.671 2015]: copy_dvb_parameters -> src=0, fe=0, freq=338000, sr=6900000, pol=, ro=3, msys=1, mtype=5, pltf=2, bw=8000000, inv=2, pids=0,100,101,104,102,103,106, apids=NULL, dpids=NULL
[Sun Jan 18 19:27:06.671 2015]: tunning to 338000000 sr:6900000 specinv:INVERSION_AUTO delsys:SYS_DVBC_ANNEX_A mod:256qam
[Sun Jan 18 19:27:06.671 2015]: setting filter on PID 0 for fd 18
[Sun Jan 18 19:27:06.671 2015]: setting filter on PID 100 for fd 19
[Sun Jan 18 19:27:06.671 2015]: setting filter on PID 101 for fd 20
[Sun Jan 18 19:27:06.671 2015]: setting filter on PID 104 for fd 21
[Sun Jan 18 19:27:06.671 2015]: setting filter on PID 102 for fd 22
[Sun Jan 18 19:27:06.671 2015]: setting filter on PID 103 for fd 23
[Sun Jan 18 19:27:06.672 2015]: setting filter on PID 106 for fd 24
[Sun Jan 18 19:27:06.672 2015]: reply -> 16 (CL:0) :
RTSP/1.0 200 OK
Cseq: 3
Transport: RTP/AVP;unicast;client_port=0-1;source=192.168.178.133;server_port=5500-5501
Session:0x61c0a0;timeout=30
com.ses.streamID: 1


[Sun Jan 18 19:27:06.672 2015]: select_and_execute[7]: Close on socket 16 (sid:0) from 192.168.178.101:48264 - type rtsp failure 0:Success
[Sun Jan 18 19:27:06.672 2015]: sockets_del: 7 -> handle 16, sid 0
[Sun Jan 18 19:27:06.672 2015]: Closing stream 0
[Sun Jan 18 19:27:06.672 2015]: closing stream 0
[Sun Jan 18 19:27:06.672 2015]: closed adapter 0 for stream 0 m:-1 s:0
[Sun Jan 18 19:27:06.672 2015]: deleting pids on adapter 0, sid 0, pids=NULL
[Sun Jan 18 19:27:06.672 2015]: clearing filters on PID 0 FD 18
[Sun Jan 18 19:27:06.672 2015]: clearing filters on PID 100 FD 19
[Sun Jan 18 19:27:06.672 2015]: clearing filters on PID 101 FD 20
[Sun Jan 18 19:27:06.672 2015]: clearing filters on PID 104 FD 21
[Sun Jan 18 19:27:06.672 2015]: clearing filters on PID 102 FD 22
[Sun Jan 18 19:27:06.672 2015]: clearing filters on PID 103 FD 23
[Sun Jan 18 19:27:06.672 2015]: clearing filters on PID 106 FD 24
[Sun Jan 18 19:27:06.672 2015]: closing adapter 0  -> fe:9 dvr:10
[Sun Jan 18 19:27:06.672 2015]: deleting pids on adapter 0, sid -1, pids=NULL
[Sun Jan 18 19:27:06.672 2015]: sockets_del: 4 -> handle 10, sid 0
[Sun Jan 18 19:27:06.672 2015]: closing DVR socket -1 pos 4 aid 0
[Sun Jan 18 19:27:06.672 2015]: sockets_del: 4 Last open socket is at index 6 current_handle 10
[Sun Jan 18 19:27:06.672 2015]: done closing adapter 0
[Sun Jan 18 19:27:06.673 2015]: closed stream 0
[Sun Jan 18 19:27:06.673 2015]: sockets_del: 7 Last open socket is at index 6 current_handle 16
[Sun Jan 18 19:27:06.673 2015]: Delete socket 7 done: sid -1
[Sun Jan 18 19:27:06.938 2015]: sockets_add: handle 9 (type 1) returning socket index 4 [192.168.178.101:48265]
[Sun Jan 18 19:27:06.938 2015]: read RTSP (from handle 9 sock_id 4): OPTIONS rtsp://192.168.178.133:554/?freq=338.000&msys=dvbc&sr=6900&mtype=256qam&pids=0,100,101,104,102,103,106 RTSP/1.0
CSeq: 1


[Sun Jan 18 19:27:06.938 2015]: reply -> 9 (CL:0) :
RTSP/1.0 200 OK
Cseq: 1
Public: OPTIONS, DESCRIBE, SETUP, PLAY, TEARDOWN


[Sun Jan 18 19:27:06.938 2015]: read RTSP (from handle 9 sock_id 4): DESCRIBE rtsp://192.168.178.133:554/?freq=338.000&msys=dvbc&sr=6900&mtype=256qam&pids=0,100,101,104,102,103,106 RTSP/1.0
Accept: application/sdp
CSeq: 2


[Sun Jan 18 19:27:06.938 2015]: starting init_hw 0
[Sun Jan 18 19:27:06.939 2015]: trying to open [0] adapter 0 and frontend 0
[Sun Jan 18 19:27:06.939 2015]: opened DVB adapter 0 fe:10 dvr:16
[Sun Jan 18 19:27:06.940 2015]: Done setting DVR buffer to 5775360 bytes
[Sun Jan 18 19:27:06.940 2015]: deleting pids on adapter 0, sid -1, pids=NULL
[Sun Jan 18 19:27:07.470 2015]: sockets_add: handle 16 (type 5) returning socket index 7 [0.0.0.0:0]
[Sun Jan 18 19:27:07.470 2015]: done opening adapter 0 fe_sys 1
[Sun Jan 18 19:27:07.470 2015]: done init_hw 1
[Sun Jan 18 19:27:07.470 2015]: starting init_hw 1
[Sun Jan 18 19:27:07.470 2015]: starting init_hw 1
[Sun Jan 18 19:27:07.470 2015]: reply -> 9 (CL:69) :
RTSP/1.0 200 OK
Cseq: 2
Public: OPTIONS, DESCRIBE, SETUP, PLAY, TEARDOWN
Content-Length: 69

v=0
o=--1 -1 IN IPV4 192.168.178.133
s=SatIPServer:1 1 1 1
t=0 0



[Sun Jan 18 19:27:07.470 2015]: select_and_execute[7]: Error on socket 16 (sid:0) from 0.0.0.0:0 - type dvr failure 11:Resource temporarily unavailable
[Sun Jan 18 19:27:07.470 2015]: read RTSP (from handle 9 sock_id 4): PLAY rtsp://192.168.178.133:554/?freq=338.000&msys=dvbc&sr=6900&mtype=256qam&pids=0,100,101,104,102,103,106 RTSP/1.0
Range: npt=0.000-
CSeq: 3


[Sun Jan 18 19:27:07.470 2015]: starting init_hw 1
[Sun Jan 18 19:27:07.470 2015]: detect_dvb_parameters (S)-> freq=338.000&msys=dvbc&sr=6900&mtype=256qam&pids=0,100,101,104,102,103,106
[Sun Jan 18 19:27:07.470 2015]: detect_dvb_parameters (E) -> src=-1, fe=-1, freq=338000, sr=6900000, pol=-1, ro=-1, msys=1, mtype=5, pltf=-1, bw=-1, inv=-1, pids=0,100,101,104,102,103,106 - apids=NULL - dpids=NULL
[Sun Jan 18 19:27:07.470 2015]: Setup stream -1 parameters, sock_id 4, handle 9
[Sun Jan 18 19:27:07.474 2015]: fill_sockaddr: gethostbyname(): Connection timed out
[Sun Jan 18 19:27:07.474 2015]: New UDP socket 17 connected to 0.0.0.0:0
[Sun Jan 18 19:27:07.474 2015]: copy_dvb_param start -> src=0, fe=0, freq=0, sr=0, pol=, ro=3, msys=0, mtype=0, pltf=2, bw=8000000, inv=2, pids=NULL, apids=NULL, dpids=NULL
[Sun Jan 18 19:27:07.474 2015]: copy_dvb_parameters -> src=0, fe=0, freq=338000, sr=6900000, pol=, ro=3, msys=1, mtype=5, pltf=2, bw=8000000, inv=2, pids=0,100,101,104,102,103,106, apids=NULL, dpids=NULL
[Sun Jan 18 19:27:07.474 2015]: Setup stream done: sid: 0 (e:1) for sock 4 handle 9
[Sun Jan 18 19:27:07.474 2015]: Play for stream 0, adapter -1, sock_id 4 handle 9
[Sun Jan 18 19:27:07.474 2015]: get free adapter -1 - a[0] => e:1 m:-1 sid_cnt:0 f:0

[Sun Jan 18 19:27:07.474 2015]: Got adapter 0 on socket 4
[Sun Jan 18 19:27:07.474 2015]: set adapter 0 for stream 0 m:0 s:1
[Sun Jan 18 19:27:07.474 2015]: setting DVB parameters for adapter 0 - master_sid 0 sid 0 old f:0
[Sun Jan 18 19:27:07.474 2015]: deleting pids on adapter 0, sid -1, pids=NULL
[Sun Jan 18 19:27:07.474 2015]: deleting pids on adapter 0, sid -1, pids=NULL
[Sun Jan 18 19:27:07.474 2015]: copy_dvb_param start -> src=0, fe=0, freq=0, sr=0, pol=, ro=3, msys=1, mtype=0, pltf=2, bw=8000000, inv=2, pids=NULL, apids=NULL, dpids=NULL
[Sun Jan 18 19:27:07.474 2015]: copy_dvb_parameters -> src=0, fe=0, freq=338000, sr=6900000, pol=, ro=3, msys=1, mtype=5, pltf=2, bw=8000000, inv=2, pids=0,100,101,104,102,103,106, apids=NULL, dpids=NULL
[Sun Jan 18 19:27:07.474 2015]: tunning to 338000000 sr:6900000 specinv:INVERSION_AUTO delsys:SYS_DVBC_ANNEX_A mod:256qam
[Sun Jan 18 19:27:07.474 2015]: setting filter on PID 0 for fd 18
[Sun Jan 18 19:27:07.474 2015]: setting filter on PID 100 for fd 19
[Sun Jan 18 19:27:07.474 2015]: setting filter on PID 101 for fd 20
[Sun Jan 18 19:27:07.474 2015]: setting filter on PID 104 for fd 21
[Sun Jan 18 19:27:07.474 2015]: setting filter on PID 102 for fd 22
[Sun Jan 18 19:27:07.474 2015]: setting filter on PID 103 for fd 23
[Sun Jan 18 19:27:07.474 2015]: setting filter on PID 106 for fd 24
[Sun Jan 18 19:27:07.474 2015]: reply -> 9 (CL:0) :
RTSP/1.0 200 OK
Cseq: 3
Transport: RTP/AVP;unicast;client_port=0-1;source=192.168.178.133;server_port=5500-5501
Session:0x61c0a0;timeout=30
com.ses.streamID: 1


[Sun Jan 18 19:27:07.474 2015]: select_and_execute[4]: Close on socket 9 (sid:0) from 192.168.178.101:48265 - type rtsp failure 0:Success
[Sun Jan 18 19:27:07.474 2015]: sockets_del: 4 -> handle 9, sid 0
[Sun Jan 18 19:27:07.475 2015]: Closing stream 0
[Sun Jan 18 19:27:07.475 2015]: closing stream 0
[Sun Jan 18 19:27:07.475 2015]: closed adapter 0 for stream 0 m:-1 s:0
[Sun Jan 18 19:27:07.475 2015]: deleting pids on adapter 0, sid 0, pids=NULL
[Sun Jan 18 19:27:07.475 2015]: clearing filters on PID 0 FD 18
[Sun Jan 18 19:27:07.475 2015]: clearing filters on PID 100 FD 19
[Sun Jan 18 19:27:07.475 2015]: clearing filters on PID 101 FD 20
[Sun Jan 18 19:27:07.475 2015]: clearing filters on PID 104 FD 21
[Sun Jan 18 19:27:07.475 2015]: clearing filters on PID 102 FD 22
[Sun Jan 18 19:27:07.475 2015]: clearing filters on PID 103 FD 23
[Sun Jan 18 19:27:07.475 2015]: clearing filters on PID 106 FD 24
[Sun Jan 18 19:27:07.475 2015]: closing adapter 0  -> fe:10 dvr:16
[Sun Jan 18 19:27:07.475 2015]: deleting pids on adapter 0, sid -1, pids=NULL
[Sun Jan 18 19:27:07.475 2015]: sockets_del: 7 -> handle 16, sid 0
[Sun Jan 18 19:27:07.475 2015]: closing DVR socket -1 pos 7 aid 0
[Sun Jan 18 19:27:07.475 2015]: sockets_del: 7 Last open socket is at index 6 current_handle 16
[Sun Jan 18 19:27:07.475 2015]: done closing adapter 0
[Sun Jan 18 19:27:07.475 2015]: closed stream 0
[Sun Jan 18 19:27:07.475 2015]: sockets_del: 4 Last open socket is at index 6 current_handle 9
[Sun Jan 18 19:27:07.475 2015]: Delete socket 4 done: sid -1
[Sun Jan 18 19:27:11.308 2015]: sockets_add: handle 9 (type 1) returning socket index 4 [192.168.178.101:48266]
[Sun Jan 18 19:27:11.308 2015]: read RTSP (from handle 9 sock_id 4): OPTIONS rtsp://192.168.178.133:554/?freq=338.000&msys=dvbc&sr=6900&mtype=256qam&pids=0,100,101,104,102,103,106 RTSP/1.0
CSeq: 1


[Sun Jan 18 19:27:11.308 2015]: reply -> 9 (CL:0) :
RTSP/1.0 200 OK
Cseq: 1
Public: OPTIONS, DESCRIBE, SETUP, PLAY, TEARDOWN


[Sun Jan 18 19:27:11.309 2015]: read RTSP (from handle 9 sock_id 4): DESCRIBE rtsp://192.168.178.133:554/?freq=338.000&msys=dvbc&sr=6900&mtype=256qam&pids=0,100,101,104,102,103,106 RTSP/1.0
Accept: application/sdp
CSeq: 2


[Sun Jan 18 19:27:11.309 2015]: starting init_hw 0
[Sun Jan 18 19:27:11.309 2015]: trying to open [0] adapter 0 and frontend 0
[Sun Jan 18 19:27:11.309 2015]: opened DVB adapter 0 fe:10 dvr:16
[Sun Jan 18 19:27:11.310 2015]: Done setting DVR buffer to 5775360 bytes
[Sun Jan 18 19:27:11.310 2015]: deleting pids on adapter 0, sid -1, pids=NULL
[Sun Jan 18 19:27:11.842 2015]: sockets_add: handle 16 (type 5) returning socket index 7 [0.0.0.0:0]
[Sun Jan 18 19:27:11.842 2015]: done opening adapter 0 fe_sys 1
[Sun Jan 18 19:27:11.842 2015]: done init_hw 1
[Sun Jan 18 19:27:11.842 2015]: starting init_hw 1
[Sun Jan 18 19:27:11.842 2015]: starting init_hw 1
[Sun Jan 18 19:27:11.842 2015]: reply -> 9 (CL:69) :
RTSP/1.0 200 OK
Cseq: 2
Public: OPTIONS, DESCRIBE, SETUP, PLAY, TEARDOWN
Content-Length: 69

v=0
o=--1 -1 IN IPV4 192.168.178.133
s=SatIPServer:1 1 1 1
t=0 0



[Sun Jan 18 19:27:11.842 2015]: read RTSP (from handle 9 sock_id 4): PLAY rtsp://192.168.178.133:554/?freq=338.000&msys=dvbc&sr=6900&mtype=256qam&pids=0,100,101,104,102,103,106 RTSP/1.0
Range: npt=0.000-
CSeq: 3


[Sun Jan 18 19:27:11.842 2015]: starting init_hw 1
[Sun Jan 18 19:27:11.842 2015]: detect_dvb_parameters (S)-> freq=338.000&msys=dvbc&sr=6900&mtype=256qam&pids=0,100,101,104,102,103,106
[Sun Jan 18 19:27:11.842 2015]: detect_dvb_parameters (E) -> src=-1, fe=-1, freq=338000, sr=6900000, pol=-1, ro=-1, msys=1, mtype=5, pltf=-1, bw=-1, inv=-1, pids=0,100,101,104,102,103,106 - apids=NULL - dpids=NULL
[Sun Jan 18 19:27:11.842 2015]: Setup stream -1 parameters, sock_id 4, handle 9
[Sun Jan 18 19:27:11.847 2015]: fill_sockaddr: gethostbyname(): Connection timed out
[Sun Jan 18 19:27:11.847 2015]: New UDP socket 17 connected to 0.0.0.0:0
[Sun Jan 18 19:27:11.847 2015]: copy_dvb_param start -> src=0, fe=0, freq=0, sr=0, pol=, ro=3, msys=0, mtype=0, pltf=2, bw=8000000, inv=2, pids=NULL, apids=NULL, dpids=NULL
[Sun Jan 18 19:27:11.847 2015]: copy_dvb_parameters -> src=0, fe=0, freq=338000, sr=6900000, pol=, ro=3, msys=1, mtype=5, pltf=2, bw=8000000, inv=2, pids=0,100,101,104,102,103,106, apids=NULL, dpids=NULL
[Sun Jan 18 19:27:11.847 2015]: Setup stream done: sid: 0 (e:1) for sock 4 handle 9
[Sun Jan 18 19:27:11.847 2015]: Play for stream 0, adapter -1, sock_id 4 handle 9
[Sun Jan 18 19:27:11.847 2015]: get free adapter -1 - a[0] => e:1 m:-1 sid_cnt:0 f:0

[Sun Jan 18 19:27:11.847 2015]: Got adapter 0 on socket 4
[Sun Jan 18 19:27:11.847 2015]: set adapter 0 for stream 0 m:0 s:1
[Sun Jan 18 19:27:11.847 2015]: setting DVB parameters for adapter 0 - master_sid 0 sid 0 old f:0
[Sun Jan 18 19:27:11.847 2015]: deleting pids on adapter 0, sid -1, pids=NULL
[Sun Jan 18 19:27:11.847 2015]: deleting pids on adapter 0, sid -1, pids=NULL
[Sun Jan 18 19:27:11.847 2015]: copy_dvb_param start -> src=0, fe=0, freq=0, sr=0, pol=, ro=3, msys=1, mtype=0, pltf=2, bw=8000000, inv=2, pids=NULL, apids=NULL, dpids=NULL
[Sun Jan 18 19:27:11.847 2015]: copy_dvb_parameters -> src=0, fe=0, freq=338000, sr=6900000, pol=, ro=3, msys=1, mtype=5, pltf=2, bw=8000000, inv=2, pids=0,100,101,104,102,103,106, apids=NULL, dpids=NULL
[Sun Jan 18 19:27:11.847 2015]: tunning to 338000000 sr:6900000 specinv:INVERSION_AUTO delsys:SYS_DVBC_ANNEX_A mod:256qam
[Sun Jan 18 19:27:11.847 2015]: setting filter on PID 0 for fd 18
[Sun Jan 18 19:27:11.847 2015]: setting filter on PID 100 for fd 19
[Sun Jan 18 19:27:11.847 2015]: setting filter on PID 101 for fd 20
[Sun Jan 18 19:27:11.847 2015]: setting filter on PID 104 for fd 21
[Sun Jan 18 19:27:11.847 2015]: setting filter on PID 102 for fd 22
[Sun Jan 18 19:27:11.847 2015]: setting filter on PID 103 for fd 23
[Sun Jan 18 19:27:11.847 2015]: setting filter on PID 106 for fd 24
[Sun Jan 18 19:27:11.847 2015]: reply -> 9 (CL:0) :
RTSP/1.0 200 OK
Cseq: 3
Transport: RTP/AVP;unicast;client_port=0-1;source=192.168.178.133;server_port=5500-5501
Session:0x61c0a0;timeout=30
com.ses.streamID: 1


[Sun Jan 18 19:27:11.847 2015]: select_and_execute[4]: Close on socket 9 (sid:0) from 192.168.178.101:48266 - type rtsp failure 0:Success
[Sun Jan 18 19:27:11.847 2015]: sockets_del: 4 -> handle 9, sid 0
[Sun Jan 18 19:27:11.847 2015]: Closing stream 0
[Sun Jan 18 19:27:11.847 2015]: closing stream 0
[Sun Jan 18 19:27:11.847 2015]: closed adapter 0 for stream 0 m:-1 s:0
[Sun Jan 18 19:27:11.847 2015]: deleting pids on adapter 0, sid 0, pids=NULL
[Sun Jan 18 19:27:11.848 2015]: clearing filters on PID 0 FD 18
[Sun Jan 18 19:27:11.848 2015]: clearing filters on PID 100 FD 19
[Sun Jan 18 19:27:11.848 2015]: clearing filters on PID 101 FD 20
[Sun Jan 18 19:27:11.848 2015]: clearing filters on PID 104 FD 21
[Sun Jan 18 19:27:11.848 2015]: clearing filters on PID 102 FD 22
[Sun Jan 18 19:27:11.848 2015]: clearing filters on PID 103 FD 23
[Sun Jan 18 19:27:11.848 2015]: clearing filters on PID 106 FD 24
[Sun Jan 18 19:27:11.848 2015]: closing adapter 0  -> fe:10 dvr:16
[Sun Jan 18 19:27:11.848 2015]: deleting pids on adapter 0, sid -1, pids=NULL
[Sun Jan 18 19:27:11.848 2015]: sockets_del: 7 -> handle 16, sid 0
[Sun Jan 18 19:27:11.848 2015]: closing DVR socket -1 pos 7 aid 0
[Sun Jan 18 19:27:11.848 2015]: sockets_del: 7 Last open socket is at index 6 current_handle 16
[Sun Jan 18 19:27:11.848 2015]: done closing adapter 0
[Sun Jan 18 19:27:11.848 2015]: closed stream 0
[Sun Jan 18 19:27:11.848 2015]: sockets_del: 4 Last open socket is at index 6 current_handle 9
[Sun Jan 18 19:27:11.848 2015]: Delete socket 4 done: sid -1
[Sun Jan 18 19:27:12.176 2015]: sockets_add: handle 9 (type 1) returning socket index 4 [192.168.178.101:48267]
[Sun Jan 18 19:27:12.176 2015]: read RTSP (from handle 9 sock_id 4): OPTIONS rtsp://192.168.178.133:554/?freq=338.000&msys=dvbc&sr=6900&mtype=256qam&pids=0,100,101,104,102,103,106 RTSP/1.0
CSeq: 1


[Sun Jan 18 19:27:12.177 2015]: reply -> 9 (CL:0) :
RTSP/1.0 200 OK
Cseq: 1
Public: OPTIONS, DESCRIBE, SETUP, PLAY, TEARDOWN


[Sun Jan 18 19:27:12.177 2015]: read RTSP (from handle 9 sock_id 4): DESCRIBE rtsp://192.168.178.133:554/?freq=338.000&msys=dvbc&sr=6900&mtype=256qam&pids=0,100,101,104,102,103,106 RTSP/1.0
Accept: application/sdp
CSeq: 2


[Sun Jan 18 19:27:12.177 2015]: starting init_hw 0
[Sun Jan 18 19:27:12.177 2015]: trying to open [0] adapter 0 and frontend 0
[Sun Jan 18 19:27:12.178 2015]: opened DVB adapter 0 fe:10 dvr:16
[Sun Jan 18 19:27:12.178 2015]: Done setting DVR buffer to 5775360 bytes
[Sun Jan 18 19:27:12.179 2015]: deleting pids on adapter 0, sid -1, pids=NULL
[Sun Jan 18 19:27:12.710 2015]: sockets_add: handle 16 (type 5) returning socket index 7 [0.0.0.0:0]
[Sun Jan 18 19:27:12.710 2015]: done opening adapter 0 fe_sys 1
[Sun Jan 18 19:27:12.710 2015]: done init_hw 1
[Sun Jan 18 19:27:12.710 2015]: starting init_hw 1
[Sun Jan 18 19:27:12.710 2015]: starting init_hw 1
[Sun Jan 18 19:27:12.710 2015]: reply -> 9 (CL:69) :
RTSP/1.0 200 OK
Cseq: 2
Public: OPTIONS, DESCRIBE, SETUP, PLAY, TEARDOWN
Content-Length: 69

v=0
o=--1 -1 IN IPV4 192.168.178.133
s=SatIPServer:1 1 1 1
t=0 0



[Sun Jan 18 19:27:12.711 2015]: read RTSP (from handle 9 sock_id 4): PLAY rtsp://192.168.178.133:554/?freq=338.000&msys=dvbc&sr=6900&mtype=256qam&pids=0,100,101,104,102,103,106 RTSP/1.0
Range: npt=0.000-
CSeq: 3


[Sun Jan 18 19:27:12.711 2015]: starting init_hw 1
[Sun Jan 18 19:27:12.711 2015]: detect_dvb_parameters (S)-> freq=338.000&msys=dvbc&sr=6900&mtype=256qam&pids=0,100,101,104,102,103,106
[Sun Jan 18 19:27:12.711 2015]: detect_dvb_parameters (E) -> src=-1, fe=-1, freq=338000, sr=6900000, pol=-1, ro=-1, msys=1, mtype=5, pltf=-1, bw=-1, inv=-1, pids=0,100,101,104,102,103,106 - apids=NULL - dpids=NULL
[Sun Jan 18 19:27:12.711 2015]: Setup stream -1 parameters, sock_id 4, handle 9
[Sun Jan 18 19:27:12.715 2015]: fill_sockaddr: gethostbyname(): Connection timed out
[Sun Jan 18 19:27:12.715 2015]: New UDP socket 17 connected to 0.0.0.0:0
[Sun Jan 18 19:27:12.715 2015]: copy_dvb_param start -> src=0, fe=0, freq=0, sr=0, pol=, ro=3, msys=0, mtype=0, pltf=2, bw=8000000, inv=2, pids=NULL, apids=NULL, dpids=NULL
[Sun Jan 18 19:27:12.715 2015]: copy_dvb_parameters -> src=0, fe=0, freq=338000, sr=6900000, pol=, ro=3, msys=1, mtype=5, pltf=2, bw=8000000, inv=2, pids=0,100,101,104,102,103,106, apids=NULL, dpids=NULL
[Sun Jan 18 19:27:12.715 2015]: Setup stream done: sid: 0 (e:1) for sock 4 handle 9
[Sun Jan 18 19:27:12.715 2015]: Play for stream 0, adapter -1, sock_id 4 handle 9
[Sun Jan 18 19:27:12.715 2015]: get free adapter -1 - a[0] => e:1 m:-1 sid_cnt:0 f:0

[Sun Jan 18 19:27:12.715 2015]: Got adapter 0 on socket 4
[Sun Jan 18 19:27:12.715 2015]: set adapter 0 for stream 0 m:0 s:1
[Sun Jan 18 19:27:12.715 2015]: setting DVB parameters for adapter 0 - master_sid 0 sid 0 old f:0
[Sun Jan 18 19:27:12.715 2015]: deleting pids on adapter 0, sid -1, pids=NULL
[Sun Jan 18 19:27:12.715 2015]: deleting pids on adapter 0, sid -1, pids=NULL
[Sun Jan 18 19:27:12.715 2015]: copy_dvb_param start -> src=0, fe=0, freq=0, sr=0, pol=, ro=3, msys=1, mtype=0, pltf=2, bw=8000000, inv=2, pids=NULL, apids=NULL, dpids=NULL
[Sun Jan 18 19:27:12.715 2015]: copy_dvb_parameters -> src=0, fe=0, freq=338000, sr=6900000, pol=, ro=3, msys=1, mtype=5, pltf=2, bw=8000000, inv=2, pids=0,100,101,104,102,103,106, apids=NULL, dpids=NULL
[Sun Jan 18 19:27:12.716 2015]: tunning to 338000000 sr:6900000 specinv:INVERSION_AUTO delsys:SYS_DVBC_ANNEX_A mod:256qam
[Sun Jan 18 19:27:12.716 2015]: setting filter on PID 0 for fd 18
[Sun Jan 18 19:27:12.716 2015]: setting filter on PID 100 for fd 19
[Sun Jan 18 19:27:12.716 2015]: setting filter on PID 101 for fd 20
[Sun Jan 18 19:27:12.716 2015]: setting filter on PID 104 for fd 21
[Sun Jan 18 19:27:12.716 2015]: setting filter on PID 102 for fd 22
[Sun Jan 18 19:27:12.716 2015]: setting filter on PID 103 for fd 23
[Sun Jan 18 19:27:12.716 2015]: setting filter on PID 106 for fd 24
[Sun Jan 18 19:27:12.716 2015]: reply -> 9 (CL:0) :
RTSP/1.0 200 OK
Cseq: 3
Transport: RTP/AVP;unicast;client_port=0-1;source=192.168.178.133;server_port=5500-5501
Session:0x61c0a0;timeout=30
com.ses.streamID: 1


[Sun Jan 18 19:27:12.716 2015]: select_and_execute[4]: Close on socket 9 (sid:0) from 192.168.178.101:48267 - type rtsp failure 0:Success
[Sun Jan 18 19:27:12.716 2015]: sockets_del: 4 -> handle 9, sid 0
[Sun Jan 18 19:27:12.716 2015]: Closing stream 0
[Sun Jan 18 19:27:12.716 2015]: closing stream 0
[Sun Jan 18 19:27:12.716 2015]: closed adapter 0 for stream 0 m:-1 s:0
[Sun Jan 18 19:27:12.717 2015]: deleting pids on adapter 0, sid 0, pids=NULL
[Sun Jan 18 19:27:12.717 2015]: clearing filters on PID 0 FD 18
[Sun Jan 18 19:27:12.717 2015]: clearing filters on PID 100 FD 19
[Sun Jan 18 19:27:12.717 2015]: clearing filters on PID 101 FD 20
[Sun Jan 18 19:27:12.717 2015]: clearing filters on PID 104 FD 21
[Sun Jan 18 19:27:12.717 2015]: clearing filters on PID 102 FD 22
[Sun Jan 18 19:27:12.717 2015]: clearing filters on PID 103 FD 23
[Sun Jan 18 19:27:12.717 2015]: clearing filters on PID 106 FD 24
[Sun Jan 18 19:27:12.717 2015]: closing adapter 0  -> fe:10 dvr:16
[Sun Jan 18 19:27:12.717 2015]: deleting pids on adapter 0, sid -1, pids=NULL
[Sun Jan 18 19:27:12.717 2015]: sockets_del: 7 -> handle 16, sid 0
[Sun Jan 18 19:27:12.717 2015]: closing DVR socket -1 pos 7 aid 0
[Sun Jan 18 19:27:12.718 2015]: sockets_del: 7 Last open socket is at index 6 current_handle 16
[Sun Jan 18 19:27:12.718 2015]: done closing adapter 0
[Sun Jan 18 19:27:12.718 2015]: closed stream 0
[Sun Jan 18 19:27:12.718 2015]: sockets_del: 4 Last open socket is at index 6 current_handle 9
[Sun Jan 18 19:27:12.718 2015]: Delete socket 4 done: sid -1
[Sun Jan 18 19:27:34.919 2015]: ssdp_reply fd: 3 -> 192.168.178.120
HTTP/1.1 200 OK
CACHE-CONTROL: max-age=1800
DATE: Sun Jan 18 19:27:34.919 2015
EXT:
LOCATION: http://192.168.178.133:8080/desc.xml
SERVER: Linux/1.0 UPnP/1.1 IDL4K/1.2
ST: urn:ses-com:device:SatIPServer:1
USN: uuid:11223344-9999-0000-b7ae-0040caa2c79d::urn:ses-com:device:SatIPServer:1
BOOTID.UPNP.ORG: 9
CONFIGID.UPNP.ORG: 0
DEVICEID.SES.COM: 9

[Sun Jan 18 19:27:34.919 2015]: ssdp_reply fd: 3 -> 192.168.178.120
HTTP/1.1 200 OK
CACHE-CONTROL: max-age=1800
DATE: Sun Jan 18 19:27:34.919 2015
EXT:
LOCATION: http://192.168.178.133:8080/desc.xml
SERVER: Linux/1.0 UPnP/1.1 IDL4K/1.2
ST: urn:ses-com:device:SatIPServer:1
USN: uuid:11223344-9999-0000-b7ae-0040caa2c79d::urn:ses-com:device:SatIPServer:1
BOOTID.UPNP.ORG: 9
CONFIGID.UPNP.ORG: 0
DEVICEID.SES.COM: 9

[Sun Jan 18 19:27:37.877 2015]: ssdp_reply fd: 3 -> 192.168.178.120
HTTP/1.1 200 OK
CACHE-CONTROL: max-age=1800
DATE: Sun Jan 18 19:27:37.877 2015
EXT:
LOCATION: http://192.168.178.133:8080/desc.xml
SERVER: Linux/1.0 UPnP/1.1 IDL4K/1.2
ST: urn:ses-com:device:SatIPServer:1
USN: uuid:11223344-9999-0000-b7ae-0040caa2c79d::urn:ses-com:device:SatIPServer:1
BOOTID.UPNP.ORG: 9
CONFIGID.UPNP.ORG: 0
DEVICEID.SES.COM: 9

[Sun Jan 18 19:27:37.877 2015]: ssdp_reply fd: 3 -> 192.168.178.120
HTTP/1.1 200 OK
CACHE-CONTROL: max-age=1800
DATE: Sun Jan 18 19:27:37.877 2015
EXT:
LOCATION: http://192.168.178.133:8080/desc.xml
SERVER: Linux/1.0 UPnP/1.1 IDL4K/1.2
ST: urn:ses-com:device:SatIPServer:1
USN: uuid:11223344-9999-0000-b7ae-0040caa2c79d::urn:ses-com:device:SatIPServer:1
BOOTID.UPNP.ORG: 9
CONFIGID.UPNP.ORG: 0
DEVICEID.SES.COM: 9

[Sun Jan 18 19:27:40.877 2015]: ssdp_reply fd: 3 -> 192.168.178.120
HTTP/1.1 200 OK
CACHE-CONTROL: max-age=1800
DATE: Sun Jan 18 19:27:40.877 2015
EXT:
LOCATION: http://192.168.178.133:8080/desc.xml
SERVER: Linux/1.0 UPnP/1.1 IDL4K/1.2
ST: urn:ses-com:device:SatIPServer:1
USN: uuid:11223344-9999-0000-b7ae-0040caa2c79d::urn:ses-com:device:SatIPServer:1
BOOTID.UPNP.ORG: 9
CONFIGID.UPNP.ORG: 0
DEVICEID.SES.COM: 9

[Sun Jan 18 19:27:40.877 2015]: ssdp_reply fd: 3 -> 192.168.178.120
HTTP/1.1 200 OK
CACHE-CONTROL: max-age=1800
DATE: Sun Jan 18 19:27:40.877 2015
EXT:
LOCATION: http://192.168.178.133:8080/desc.xml
SERVER: Linux/1.0 UPnP/1.1 IDL4K/1.2
ST: urn:ses-com:device:SatIPServer:1
USN: uuid:11223344-9999-0000-b7ae-0040caa2c79d::urn:ses-com:device:SatIPServer:1
BOOTID.UPNP.ORG: 9
CONFIGID.UPNP.ORG: 0
DEVICEID.SES.COM: 9

[Sun Jan 18 19:27:43.925 2015]: ssdp_reply fd: 3 -> 192.168.178.120
HTTP/1.1 200 OK
CACHE-CONTROL: max-age=1800
DATE: Sun Jan 18 19:27:43.925 2015
EXT:
LOCATION: http://192.168.178.133:8080/desc.xml
SERVER: Linux/1.0 UPnP/1.1 IDL4K/1.2
ST: urn:ses-com:device:SatIPServer:1
USN: uuid:11223344-9999-0000-b7ae-0040caa2c79d::urn:ses-com:device:SatIPServer:1
BOOTID.UPNP.ORG: 9
CONFIGID.UPNP.ORG: 0
DEVICEID.SES.COM: 9

[Sun Jan 18 19:27:43.925 2015]: ssdp_reply fd: 3 -> 192.168.178.120
HTTP/1.1 200 OK
CACHE-CONTROL: max-age=1800
DATE: Sun Jan 18 19:27:43.925 2015
EXT:
LOCATION: http://192.168.178.133:8080/desc.xml
SERVER: Linux/1.0 UPnP/1.1 IDL4K/1.2
ST: urn:ses-com:device:SatIPServer:1
USN: uuid:11223344-9999-0000-b7ae-0040caa2c79d::urn:ses-com:device:SatIPServer:1
BOOTID.UPNP.ORG: 9
CONFIGID.UPNP.ORG: 0
DEVICEID.SES.COM: 9

[Sun Jan 18 19:27:46.918 2015]: ssdp_reply fd: 3 -> 192.168.178.120
HTTP/1.1 200 OK
CACHE-CONTROL: max-age=1800
DATE: Sun Jan 18 19:27:46.918 2015
EXT:
LOCATION: http://192.168.178.133:8080/desc.xml
SERVER: Linux/1.0 UPnP/1.1 IDL4K/1.2
ST: urn:ses-com:device:SatIPServer:1
USN: uuid:11223344-9999-0000-b7ae-0040caa2c79d::urn:ses-com:device:SatIPServer:1
BOOTID.UPNP.ORG: 9
CONFIGID.UPNP.ORG: 0
DEVICEID.SES.COM: 9

[Sun Jan 18 19:27:46.918 2015]: ssdp_reply fd: 3 -> 192.168.178.120
HTTP/1.1 200 OK
CACHE-CONTROL: max-age=1800
DATE: Sun Jan 18 19:27:46.918 2015
EXT:
LOCATION: http://192.168.178.133:8080/desc.xml
SERVER: Linux/1.0 UPnP/1.1 IDL4K/1.2
ST: urn:ses-com:device:SatIPServer:1
USN: uuid:11223344-9999-0000-b7ae-0040caa2c79d::urn:ses-com:device:SatIPServer:1
BOOTID.UPNP.ORG: 9
CONFIGID.UPNP.ORG: 0
DEVICEID.SES.COM: 9

[Sun Jan 18 19:27:49.918 2015]: ssdp_reply fd: 3 -> 192.168.178.120
HTTP/1.1 200 OK
CACHE-CONTROL: max-age=1800
DATE: Sun Jan 18 19:27:49.918 2015
EXT:
LOCATION: http://192.168.178.133:8080/desc.xml
SERVER: Linux/1.0 UPnP/1.1 IDL4K/1.2
ST: urn:ses-com:device:SatIPServer:1
USN: uuid:11223344-9999-0000-b7ae-0040caa2c79d::urn:ses-com:device:SatIPServer:1
BOOTID.UPNP.ORG: 9
CONFIGID.UPNP.ORG: 0
DEVICEID.SES.COM: 9

[Sun Jan 18 19:27:49.918 2015]: ssdp_reply fd: 3 -> 192.168.178.120
HTTP/1.1 200 OK
CACHE-CONTROL: max-age=1800
DATE: Sun Jan 18 19:27:49.918 2015
EXT:
LOCATION: http://192.168.178.133:8080/desc.xml
SERVER: Linux/1.0 UPnP/1.1 IDL4K/1.2
ST: urn:ses-com:device:SatIPServer:1
USN: uuid:11223344-9999-0000-b7ae-0040caa2c79d::urn:ses-com:device:SatIPServer:1
BOOTID.UPNP.ORG: 9
CONFIGID.UPNP.ORG: 0
DEVICEID.SES.COM: 9

[Sun Jan 18 19:27:59.728 2015]: sockets_del: 5 -> handle 12, sid 1
[Sun Jan 18 19:27:59.728 2015]: closing DVR socket -1 pos 5 aid 1
[Sun Jan 18 19:27:59.728 2015]: closing adapter 1  -> fe:11 dvr:12
[Sun Jan 18 19:27:59.728 2015]: deleting pids on adapter 1, sid -1, pids=NULL
[Sun Jan 18 19:27:59.728 2015]: sockets_del: 5 -> handle -1, sid 1
[Sun Jan 18 19:27:59.728 2015]: done closing adapter 1
[Sun Jan 18 19:27:59.729 2015]: sockets_del: 5 Last open socket is at index 6 current_handle 12
[Sun Jan 18 19:27:59.729 2015]: sockets_del: 6 -> handle 14, sid 2
[Sun Jan 18 19:27:59.729 2015]: closing DVR socket -1 pos 6 aid 2
[Sun Jan 18 19:27:59.729 2015]: closing adapter 2  -> fe:13 dvr:14
[Sun Jan 18 19:27:59.729 2015]: deleting pids on adapter 2, sid -1, pids=NULL
[Sun Jan 18 19:27:59.729 2015]: sockets_del: 6 -> handle -1, sid 2
[Sun Jan 18 19:27:59.729 2015]: done closing adapter 2
[Sun Jan 18 19:27:59.730 2015]: sockets_del: 6 Last open socket is at index 3 current_handle 14
[Sun Jan 18 19:28:34.886 2015]: ssdp_reply fd: 3 -> 192.168.178.120
HTTP/1.1 200 OK
CACHE-CONTROL: max-age=1800
DATE: Sun Jan 18 19:28:34.886 2015
EXT:
LOCATION: http://192.168.178.133:8080/desc.xml
SERVER: Linux/1.0 UPnP/1.1 IDL4K/1.2
ST: urn:ses-com:device:SatIPServer:1
USN: uuid:11223344-9999-0000-b7ae-0040caa2c79d::urn:ses-com:device:SatIPServer:1
BOOTID.UPNP.ORG: 9
CONFIGID.UPNP.ORG: 0
DEVICEID.SES.COM: 9

[Sun Jan 18 19:28:34.886 2015]: ssdp_reply fd: 3 -> 192.168.178.120
HTTP/1.1 200 OK
CACHE-CONTROL: max-age=1800
DATE: Sun Jan 18 19:28:34.886 2015
EXT:
LOCATION: http://192.168.178.133:8080/desc.xml
SERVER: Linux/1.0 UPnP/1.1 IDL4K/1.2
ST: urn:ses-com:device:SatIPServer:1
USN: uuid:11223344-9999-0000-b7ae-0040caa2c79d::urn:ses-com:device:SatIPServer:1
BOOTID.UPNP.ORG: 9
CONFIGID.UPNP.ORG: 0
DEVICEID.SES.COM: 9

[Sun Jan 18 19:28:37.883 2015]: ssdp_reply fd: 3 -> 192.168.178.120
HTTP/1.1 200 OK
CACHE-CONTROL: max-age=1800
DATE: Sun Jan 18 19:28:37.883 2015
EXT:
LOCATION: http://192.168.178.133:8080/desc.xml
SERVER: Linux/1.0 UPnP/1.1 IDL4K/1.2
ST: urn:ses-com:device:SatIPServer:1
USN: uuid:11223344-9999-0000-b7ae-0040caa2c79d::urn:ses-com:device:SatIPServer:1
BOOTID.UPNP.ORG: 9
CONFIGID.UPNP.ORG: 0
DEVICEID.SES.COM: 9

[Sun Jan 18 19:28:37.883 2015]: ssdp_reply fd: 3 -> 192.168.178.120
HTTP/1.1 200 OK
CACHE-CONTROL: max-age=1800
DATE: Sun Jan 18 19:28:37.883 2015
EXT:
LOCATION: http://192.168.178.133:8080/desc.xml
SERVER: Linux/1.0 UPnP/1.1 IDL4K/1.2
ST: urn:ses-com:device:SatIPServer:1
USN: uuid:11223344-9999-0000-b7ae-0040caa2c79d::urn:ses-com:device:SatIPServer:1
BOOTID.UPNP.ORG: 9
CONFIGID.UPNP.ORG: 0
DEVICEID.SES.COM: 9

[Sun Jan 18 19:28:40.883 2015]: ssdp_reply fd: 3 -> 192.168.178.120
HTTP/1.1 200 OK
CACHE-CONTROL: max-age=1800
DATE: Sun Jan 18 19:28:40.883 2015
EXT:
LOCATION: http://192.168.178.133:8080/desc.xml
SERVER: Linux/1.0 UPnP/1.1 IDL4K/1.2
ST: urn:ses-com:device:SatIPServer:1
USN: uuid:11223344-9999-0000-b7ae-0040caa2c79d::urn:ses-com:device:SatIPServer:1
BOOTID.UPNP.ORG: 9
CONFIGID.UPNP.ORG: 0
DEVICEID.SES.COM: 9

[Sun Jan 18 19:28:40.883 2015]: ssdp_reply fd: 3 -> 192.168.178.120
HTTP/1.1 200 OK
CACHE-CONTROL: max-age=1800
DATE: Sun Jan 18 19:28:40.883 2015
EXT:
LOCATION: http://192.168.178.133:8080/desc.xml
SERVER: Linux/1.0 UPnP/1.1 IDL4K/1.2
ST: urn:ses-com:device:SatIPServer:1
USN: uuid:11223344-9999-0000-b7ae-0040caa2c79d::urn:ses-com:device:SatIPServer:1
BOOTID.UPNP.ORG: 9
CONFIGID.UPNP.ORG: 0
DEVICEID.SES.COM: 9

[Sun Jan 18 19:28:44.064 2015]: ssdp_reply fd: 3 -> 192.168.178.120
HTTP/1.1 200 OK
CACHE-CONTROL: max-age=1800
DATE: Sun Jan 18 19:28:44.064 2015
EXT:
LOCATION: http://192.168.178.133:8080/desc.xml
SERVER: Linux/1.0 UPnP/1.1 IDL4K/1.2
ST: urn:ses-com:device:SatIPServer:1
USN: uuid:11223344-9999-0000-b7ae-0040caa2c79d::urn:ses-com:device:SatIPServer:1
BOOTID.UPNP.ORG: 9
CONFIGID.UPNP.ORG: 0
DEVICEID.SES.COM: 9

[Sun Jan 18 19:28:44.064 2015]: ssdp_reply fd: 3 -> 192.168.178.120
HTTP/1.1 200 OK
CACHE-CONTROL: max-age=1800
DATE: Sun Jan 18 19:28:44.064 2015
EXT:
LOCATION: http://192.168.178.133:8080/desc.xml
SERVER: Linux/1.0 UPnP/1.1 IDL4K/1.2
ST: urn:ses-com:device:SatIPServer:1
USN: uuid:11223344-9999-0000-b7ae-0040caa2c79d::urn:ses-com:device:SatIPServer:1
BOOTID.UPNP.ORG: 9
CONFIGID.UPNP.ORG: 0
DEVICEID.SES.COM: 9

[Sun Jan 18 19:28:46.923 2015]: ssdp_reply fd: 3 -> 192.168.178.120
HTTP/1.1 200 OK
CACHE-CONTROL: max-age=1800
DATE: Sun Jan 18 19:28:46.923 2015
EXT:
LOCATION: http://192.168.178.133:8080/desc.xml
SERVER: Linux/1.0 UPnP/1.1 IDL4K/1.2
ST: urn:ses-com:device:SatIPServer:1
USN: uuid:11223344-9999-0000-b7ae-0040caa2c79d::urn:ses-com:device:SatIPServer:1
BOOTID.UPNP.ORG: 9
CONFIGID.UPNP.ORG: 0
DEVICEID.SES.COM: 9

[Sun Jan 18 19:28:46.923 2015]: ssdp_reply fd: 3 -> 192.168.178.120
HTTP/1.1 200 OK
CACHE-CONTROL: max-age=1800
DATE: Sun Jan 18 19:28:46.923 2015
EXT:
LOCATION: http://192.168.178.133:8080/desc.xml
SERVER: Linux/1.0 UPnP/1.1 IDL4K/1.2
ST: urn:ses-com:device:SatIPServer:1
USN: uuid:11223344-9999-0000-b7ae-0040caa2c79d::urn:ses-com:device:SatIPServer:1
BOOTID.UPNP.ORG: 9
CONFIGID.UPNP.ORG: 0
DEVICEID.SES.COM: 9

^Cselect_and_execute: select() error: Interrupted system call
[Sun Jan 18 19:28:49.713 2015]: sockets_del: 3 -> handle 6, sid -1
[Sun Jan 18 19:28:49.713 2015]: sockets_del: 3 Last open socket is at index 2 current_handle 6
[Sun Jan 18 19:28:49.713 2015]: sockets_del: 2 -> handle 5, sid -1
[Sun Jan 18 19:28:49.713 2015]: sockets_del: 2 Last open socket is at index 1 current_handle 5
[Sun Jan 18 19:28:49.713 2015]: sockets_del: 1 -> handle 4, sid -1
[Sun Jan 18 19:28:49.714 2015]: sockets_del: 1 Last open socket is at index 0 current_handle 4
stream.c:585 allocation_wrapper free called with argument 0x217fee0 - done free
stream.c:587 allocation_wrapper free called with argument 0x2180030 - done free
stream.c:589 allocation_wrapper free called with argument 0x2180180 - done free
stream.c:591 allocation_wrapper free called with argument 0x21802d0 - done free
adapter.c:692 allocation_wrapper free called with argument 0x2176cf0 - done free
adapter.c:692 allocation_wrapper free called with argument 0x2179100 - done free
adapter.c:692 allocation_wrapper free called with argument 0x217b510 - done free
root@yavdr2:/usr/src/satip/minisatip-master#

**Comment by catalinii** [comment]
There are 2 issues here:

1) This was an attempt to stream using rtsp over tcp (as u see there is no Transport: header)
2) Changing VLC to use rtsp over udp still did not play since it expects the DESCRIBE to contain information that is not in satip specification

Today I have added support for HTTP streaming so you can use port 8080 to do that (tested OK with VLC).

**Comment by 9000h** [comment]
I will test this evening.

>2) Changing VLC to use rtsp over udp still did not play since it expects the DESCRIBE to contain i>nformation that is not in satip specification

all the SAT>IP servers I have seen did it implement (octonet,Telebit R1) as it's very handy to use on the client end. It's also much easier for testing.

**Comment by catalinii** [comment]
Give a tcpdump between vlc and an satip server that works.

Thanks

**Comment by 9000h** [comment]
I try a bit, if I start VLC with
rtsp://192.168.178.101:554/stream=0?freq=12188&sr=27500&pol=h&msys=dvbs&pids=0,44,163,104,106
it hangs in a strange loop on my MAC but from a sniff I saw a SETUP sequence
SETUP rtsp://192.168.178.101:554/?src=1&freq=12188&sr=27500&pol=h&msys=dvbs&pids=0,44,163,104,106/stream=0 RTSP/1.0
this is wrong but gives me a idea
if I connect to the same stream with a second player it plays the stream, strange
smplayer "rtsp://192.168.178.101:554/stream=0?freq=12188&sr=27500&pol=h&msys=dvbs&pids=0,44,163,104,106"

**Comment by 9000h** [comment]
here are the rtsp
No.     Time           Source                Destination           Protocol Length Info
      8 1.693412000    192.168.178.130       192.168.178.101       RTSP     255    OPTIONS rtsp://192.168.178.101:554/?src=1&freq=12188&sr=27500&pol=h&msys=dvbs&pids=0,44,163,104,106 RTSP/1.0

Frame 8: 255 bytes on wire (2040 bits), 255 bytes captured (2040 bits) on interface 0
Ethernet II, Src: e0:f8:47:12:db:ce (e0:f8:47:12:db:ce), Dst: 00:22:4d:9d:38:05 (00:22:4d:9d:38:05)
Internet Protocol Version 4, Src: 192.168.178.130 (192.168.178.130), Dst: 192.168.178.101 (192.168.178.101)
Transmission Control Protocol, Src Port: 63024 (63024), Dst Port: 554 (554), Seq: 1, Ack: 1, Len: 189
Real Time Streaming Protocol
    Request: OPTIONS rtsp://192.168.178.101:554/?src=1&freq=12188&sr=27500&pol=h&msys=dvbs&pids=0,44,163,104,106 RTSP/1.0\r\n
    CSeq: 2\r\n
    User-Agent: LibVLC/2.2.0-rc1 (LIVE555 Streaming Media v2014.01.21)\r\n
    \r\n

No.     Time           Source                Destination           Protocol Length Info
     12 1.694840000    192.168.178.101       192.168.178.130       RTSP     144    Reply: RTSP/1.0 200 OK

Frame 12: 144 bytes on wire (1152 bits), 144 bytes captured (1152 bits) on interface 0
Ethernet II, Src: 00:22:4d:9d:38:05 (00:22:4d:9d:38:05), Dst: e0:f8:47:12:db:ce (e0:f8:47:12:db:ce)
Internet Protocol Version 4, Src: 192.168.178.101 (192.168.178.101), Dst: 192.168.178.130 (192.168.178.130)
Transmission Control Protocol, Src Port: 554 (554), Dst Port: 63024 (63024), Seq: 1, Ack: 190, Len: 78
Real Time Streaming Protocol
    Response: RTSP/1.0 200 OK\r\n
    Cseq: 2\r\n
    Public: OPTIONS, DESCRIBE, SETUP, PLAY, TEARDOWN\r\n
    \r\n

No.     Time           Source                Destination           Protocol Length Info
     16 1.694988000    192.168.178.130       192.168.178.101       RTSP     281    DESCRIBE rtsp://192.168.178.101:554/?src=1&freq=12188&sr=27500&pol=h&msys=dvbs&pids=0,44,163,104,106 RTSP/1.0

Frame 16: 281 bytes on wire (2248 bits), 281 bytes captured (2248 bits) on interface 0
Ethernet II, Src: e0:f8:47:12:db:ce (e0:f8:47:12:db:ce), Dst: 00:22:4d:9d:38:05 (00:22:4d:9d:38:05)
Internet Protocol Version 4, Src: 192.168.178.130 (192.168.178.130), Dst: 192.168.178.101 (192.168.178.101)
Transmission Control Protocol, Src Port: 63024 (63024), Dst Port: 554 (554), Seq: 190, Ack: 79, Len: 215
Real Time Streaming Protocol
    Request: DESCRIBE rtsp://192.168.178.101:554/?src=1&freq=12188&sr=27500&pol=h&msys=dvbs&pids=0,44,163,104,106 RTSP/1.0\r\n
    CSeq: 3\r\n
    User-Agent: LibVLC/2.2.0-rc1 (LIVE555 Streaming Media v2014.01.21)\r\n
    Accept: application/sdp\r\n
    \r\n

No.     Time           Source                Destination           Protocol Length Info
     17 1.696219000    192.168.178.101       192.168.178.130       RTSP/SDP 349    Reply: RTSP/1.0 200 OK

Frame 17: 349 bytes on wire (2792 bits), 349 bytes captured (2792 bits) on interface 0
Ethernet II, Src: 00:22:4d:9d:38:05 (00:22:4d:9d:38:05), Dst: e0:f8:47:12:db:ce (e0:f8:47:12:db:ce)
Internet Protocol Version 4, Src: 192.168.178.101 (192.168.178.101), Dst: 192.168.178.130 (192.168.178.130)
Transmission Control Protocol, Src Port: 554 (554), Dst Port: 63024 (63024), Seq: 79, Ack: 405, Len: 283
Real Time Streaming Protocol
    Response: RTSP/1.0 200 OK\r\n
    CSeq: 3\r\n
    Content-type: application/sdp
    Content-length: 199
    \r\n
    Session Description Protocol
        Session Description Protocol Version (v): 0
        Owner/Creator, Session Id (o): - 0 0 IN IP4 192.168.178.101
        Session Name (s): SatIPServer:1 2 0 0
        Time Description, active time (t): 0 0
        Media Description, name and address (m): video 0 RTP/AVP 33
            Media Type: video
            Media Port: 0
            Media Protocol: RTP/AVP
            Media Format: MPEG-II transport streams
        Connection Information (c): IN IP4 0.0.0.0
        Media Attribute (a): control:stream=0
        Media Attribute (a): fmtp:33 ver=1.0;src=1;tuner=0,0,0,0,0,0,dvbs,,,,0,;pids=
        Media Attribute (a): inactive
Real Time Streaming Protocol
    \r\n
    Data (2 bytes)

No.     Time           Source                Destination           Protocol Length Info
     22 1.696829000    192.168.178.130       192.168.178.101       RTSP     314    SETUP rtsp://192.168.178.101:554/?src=1&freq=12188&sr=27500&pol=h&msys=dvbs&pids=0,44,163,104,106/stream=0 RTSP/1.0

Frame 22: 314 bytes on wire (2512 bits), 314 bytes captured (2512 bits) on interface 0
Ethernet II, Src: e0:f8:47:12:db:ce (e0:f8:47:12:db:ce), Dst: 00:22:4d:9d:38:05 (00:22:4d:9d:38:05)
Internet Protocol Version 4, Src: 192.168.178.130 (192.168.178.130), Dst: 192.168.178.101 (192.168.178.101)
Transmission Control Protocol, Src Port: 63024 (63024), Dst Port: 554 (554), Seq: 405, Ack: 362, Len: 248
Real Time Streaming Protocol
    Request: SETUP rtsp://192.168.178.101:554/?src=1&freq=12188&sr=27500&pol=h&msys=dvbs&pids=0,44,163,104,106/stream=0 RTSP/1.0\r\n
    CSeq: 4\r\n
    User-Agent: LibVLC/2.2.0-rc1 (LIVE555 Streaming Media v2014.01.21)\r\n
    Transport: RTP/AVP;unicast;client_port=61864-61865
    \r\n

No.     Time           Source                Destination           Protocol Length Info
     23 1.698150000    192.168.178.101       192.168.178.130       RTSP     243    Reply: RTSP/1.0 200 OK

Frame 23: 243 bytes on wire (1944 bits), 243 bytes captured (1944 bits) on interface 0
Ethernet II, Src: 00:22:4d:9d:38:05 (00:22:4d:9d:38:05), Dst: e0:f8:47:12:db:ce (e0:f8:47:12:db:ce)
Internet Protocol Version 4, Src: 192.168.178.101 (192.168.178.101), Dst: 192.168.178.130 (192.168.178.130)
Transmission Control Protocol, Src Port: 554 (554), Dst Port: 63024 (63024), Seq: 362, Ack: 653, Len: 177
Real Time Streaming Protocol
    Response: RTSP/1.0 200 OK\r\n
    Cseq: 4\r\n
    Transport: RTP/AVP;unicast;client_port=61864-61865;source=192.168.178.101;server_port=34287-34288
    Session: 0x61c160;timeout=30
    com.ses.streamID: 1\r\n
    \r\n

**Comment by 9000h** [comment]
ok I got on step ahead there is something missing in DESCRIBE

when I add
                        http_response (s->sock, "RTSP", 200, "Content-Base: rtsp://192.168.178.101/", sbuf, cseq, 0);

then it plays a bit

**Comment by catalinii** [comment]
You are right, I am missing the Content -base thing.
I have added it in the last commit.

**Comment by catalinii** [comment]
So is it ok over HTTP, can I close this ? :)

**Comment by 9000h** [comment]
did test rtsp and http yesterday and look good now VLC seems to be happy

**Comment by catalinii** [comment]
Thx
