### ISSUE TITLE
new bug with 2 clients

### ISSUE THREAD

**Issue by 9000h** [catalinii/minisatip#166]
there is a new bug since 0.3.60, when my 2 Panasonic's try to change the channel the  second could only tune to the same transponder and same sat position.
The other issue after is a restart of minisatip the Panasonic's where not able to reconnect to the current channel.

with a older version 0.3.49 all this work fine.

log sent via email

**Comment by 9000h** [comment]
not sure what was happen but 0.3.61 seems to work fine

**Comment by 9000h** [comment]
there seems to be still a issue, unfortunately I have the minisatip running without debug 
but I did modify the status.html where I can see the working clients
```
Adapter 0 Sys 6 Freq 11992, SR 27500, Strength 23 SNR 11 pids=767,18,4104,771,32,4098,4105,0,1,98,17,6996,8020,6228,6740,16,20,2
Adapter 1 Sys 1 Freq 338, SR 6900, Strength 240 SNR 14 pids=101,106,104,102,103,0,3150,100,5200,5320,300,600,3100,3110,3120,3130,3140,3180,5240,200,800,3160
Adapter 2 Sys 0 Freq 0, SR 0, Strength 0 SNR 0 pids=
Stream 0 enabled 1 rhost: 192.168.178.138:3456
Stream 1 enabled 1 rhost: 192.168.178.140:49530
Stream 2 enabled 0 rhost: :0 
```
stream 0 is dvb-s first card
stream 1 is dvb-c second card

the next dvb-s client should go to the third card but get's a 404
```
No.     Time           Source                Destination           Protocol Length Info
      4 0.003546       192.168.178.124       192.168.178.133       RTSP     252    SETUP rtsp://192.168.178.133:554/?src=1&freq=11494.00&pol=h&ro=0.35&msys=dvbs2&mtype=8psk&plts=off&sr=22000&fec=23 RTSP/1.0

Frame 4: 252 bytes on wire (2016 bits), 252 bytes captured (2016 bits)
Ethernet II, Src: Panasoni_e1:0e:1f (20:c6:eb:e1:0e:1f), Dst: FirstInt_a2:c7:9d (00:40:ca:a2:c7:9d)
Internet Protocol Version 4, Src: 192.168.178.124 (192.168.178.124), Dst: 192.168.178.133 (192.168.178.133)
Transmission Control Protocol, Src Port: 26117 (26117), Dst Port: 554 (554), Seq: 1, Ack: 1, Len: 186
Real Time Streaming Protocol

No.     Time           Source                Destination           Protocol Length Info
      6 0.003872       192.168.178.133       192.168.178.124       RTSP     299    Reply: RTSP/1.0 200 OK

Frame 6: 299 bytes on wire (2392 bits), 299 bytes captured (2392 bits)
Ethernet II, Src: FirstInt_a2:c7:9d (00:40:ca:a2:c7:9d), Dst: Panasoni_e1:0e:1f (20:c6:eb:e1:0e:1f)
Internet Protocol Version 4, Src: 192.168.178.133 (192.168.178.133), Dst: 192.168.178.124 (192.168.178.124)
Transmission Control Protocol, Src Port: 554 (554), Dst Port: 26117 (26117), Seq: 1, Ack: 187, Len: 233
Real Time Streaming Protocol

No.     Time           Source                Destination           Protocol Length Info
      7 0.011336       192.168.178.124       192.168.178.133       RTSP     172    PLAY rtsp://192.168.178.133:554/stream=3?pids=0,1,2,16,17,18,20 RTSP/1.0

Frame 7: 172 bytes on wire (1376 bits), 172 bytes captured (1376 bits)
Ethernet II, Src: Panasoni_e1:0e:1f (20:c6:eb:e1:0e:1f), Dst: FirstInt_a2:c7:9d (00:40:ca:a2:c7:9d)
Internet Protocol Version 4, Src: 192.168.178.124 (192.168.178.124), Dst: 192.168.178.133 (192.168.178.133)
Transmission Control Protocol, Src Port: 26117 (26117), Dst Port: 554 (554), Seq: 187, Ack: 234, Len: 106
Real Time Streaming Protocol

No.     Time           Source                Destination           Protocol Length Info
      8 0.011429       192.168.178.133       192.168.178.124       RTSP     209    Reply: RTSP/1.0 404 Not Found

Frame 8: 209 bytes on wire (1672 bits), 209 bytes captured (1672 bits)
Ethernet II, Src: FirstInt_a2:c7:9d (00:40:ca:a2:c7:9d), Dst: Panasoni_e1:0e:1f (20:c6:eb:e1:0e:1f)
Internet Protocol Version 4, Src: 192.168.178.133 (192.168.178.133), Dst: 192.168.178.124 (192.168.178.124)
Transmission Control Protocol, Src Port: 554 (554), Dst Port: 26117 (26117), Seq: 234, Ack: 293, Len: 143
Real Time Streaming Protocol

No.     Time           Source                Destination           Protocol Length Info
     10 0.111246       192.168.178.124       192.168.178.133       RTSP     153    TEARDOWN rtsp://192.168.178.133:554/stream=3 RTSP/1.0

Frame 10: 153 bytes on wire (1224 bits), 153 bytes captured (1224 bits)
Ethernet II, Src: Panasoni_e1:0e:1f (20:c6:eb:e1:0e:1f), Dst: FirstInt_a2:c7:9d (00:40:ca:a2:c7:9d)
Internet Protocol Version 4, Src: 192.168.178.124 (192.168.178.124), Dst: 192.168.178.133 (192.168.178.133)
Transmission Control Protocol, Src Port: 26117 (26117), Dst Port: 554 (554), Seq: 293, Ack: 377, Len: 87
Real Time Streaming Protocol

No.     Time           Source                Destination           Protocol Length Info
     11 0.111383       192.168.178.133       192.168.178.124       RTSP     152    Reply: RTSP/1.0 200 OK

Frame 11: 152 bytes on wire (1216 bits), 152 bytes captured (1216 bits)
Ethernet II, Src: FirstInt_a2:c7:9d (00:40:ca:a2:c7:9d), Dst: Panasoni_e1:0e:1f (20:c6:eb:e1:0e:1f)
Internet Protocol Version 4, Src: 192.168.178.133 (192.168.178.133), Dst: 192.168.178.124 (192.168.178.124)
Transmission Control Protocol, Src Port: 554 (554), Dst Port: 26117 (26117), Seq: 377, Ack: 380, Len: 86
Real Time Streaming Protocol

No.     Time           Source                Destination           Protocol Length Info
     18 13.054562      192.168.178.124       192.168.178.133       RTSP     252    SETUP rtsp://192.168.178.133:554/?src=1&freq=11582.00&pol=h&ro=0.35&msys=dvbs2&mtype=8psk&plts=off&sr=22000&fec=23 RTSP/1.0

Frame 18: 252 bytes on wire (2016 bits), 252 bytes captured (2016 bits)
Ethernet II, Src: Panasoni_e1:0e:1f (20:c6:eb:e1:0e:1f), Dst: FirstInt_a2:c7:9d (00:40:ca:a2:c7:9d)
Internet Protocol Version 4, Src: 192.168.178.124 (192.168.178.124), Dst: 192.168.178.133 (192.168.178.133)
Transmission Control Protocol, Src Port: 18454 (18454), Dst Port: 554 (554), Seq: 1, Ack: 1, Len: 186
Real Time Streaming Protocol

No.     Time           Source                Destination           Protocol Length Info
     20 13.054866      192.168.178.133       192.168.178.124       RTSP     299    Reply: RTSP/1.0 200 OK

Frame 20: 299 bytes on wire (2392 bits), 299 bytes captured (2392 bits)
Ethernet II, Src: FirstInt_a2:c7:9d (00:40:ca:a2:c7:9d), Dst: Panasoni_e1:0e:1f (20:c6:eb:e1:0e:1f)
Internet Protocol Version 4, Src: 192.168.178.133 (192.168.178.133), Dst: 192.168.178.124 (192.168.178.124)
Transmission Control Protocol, Src Port: 554 (554), Dst Port: 18454 (18454), Seq: 1, Ack: 187, Len: 233
Real Time Streaming Protocol

No.     Time           Source                Destination           Protocol Length Info
     21 13.060535      192.168.178.124       192.168.178.133       RTSP     172    PLAY rtsp://192.168.178.133:554/stream=3?pids=0,1,2,16,17,18,20 RTSP/1.0

Frame 21: 172 bytes on wire (1376 bits), 172 bytes captured (1376 bits)
Ethernet II, Src: Panasoni_e1:0e:1f (20:c6:eb:e1:0e:1f), Dst: FirstInt_a2:c7:9d (00:40:ca:a2:c7:9d)
Internet Protocol Version 4, Src: 192.168.178.124 (192.168.178.124), Dst: 192.168.178.133 (192.168.178.133)
Transmission Control Protocol, Src Port: 18454 (18454), Dst Port: 554 (554), Seq: 187, Ack: 234, Len: 106
Real Time Streaming Protocol

No.     Time           Source                Destination           Protocol Length Info
     22 13.060628      192.168.178.133       192.168.178.124       RTSP     209    Reply: RTSP/1.0 404 Not Found

Frame 22: 209 bytes on wire (1672 bits), 209 bytes captured (1672 bits)
Ethernet II, Src: FirstInt_a2:c7:9d (00:40:ca:a2:c7:9d), Dst: Panasoni_e1:0e:1f (20:c6:eb:e1:0e:1f)
Internet Protocol Version 4, Src: 192.168.178.133 (192.168.178.133), Dst: 192.168.178.124 (192.168.178.124)
Transmission Control Protocol, Src Port: 554 (554), Dst Port: 18454 (18454), Seq: 234, Ack: 293, Len: 143
Real Time Streaming Protocol

No.     Time           Source                Destination           Protocol Length Info
     24 13.160463      192.168.178.124       192.168.178.133       RTSP     153    TEARDOWN rtsp://192.168.178.133:554/stream=3 RTSP/1.0

Frame 24: 153 bytes on wire (1224 bits), 153 bytes captured (1224 bits)
Ethernet II, Src: Panasoni_e1:0e:1f (20:c6:eb:e1:0e:1f), Dst: FirstInt_a2:c7:9d (00:40:ca:a2:c7:9d)
Internet Protocol Version 4, Src: 192.168.178.124 (192.168.178.124), Dst: 192.168.178.133 (192.168.178.133)
Transmission Control Protocol, Src Port: 18454 (18454), Dst Port: 554 (554), Seq: 293, Ack: 377, Len: 87
Real Time Streaming Protocol

No.     Time           Source                Destination           Protocol Length Info
     25 13.160600      192.168.178.133       192.168.178.124       RTSP     152    Reply: RTSP/1.0 200 OK

Frame 25: 152 bytes on wire (1216 bits), 152 bytes captured (1216 bits)
Ethernet II, Src: FirstInt_a2:c7:9d (00:40:ca:a2:c7:9d), Dst: Panasoni_e1:0e:1f (20:c6:eb:e1:0e:1f)
Internet Protocol Version 4, Src: 192.168.178.133 (192.168.178.133), Dst: 192.168.178.124 (192.168.178.124)
Transmission Control Protocol, Src Port: 554 (554), Dst Port: 18454 (18454), Seq: 377, Ack: 380, Len: 86
Real Time Streaming Protocol
```

**Comment by 9000h** [comment]
it may happen first after second use of the server

**Comment by 9000h** [comment]
my modified status page
```
<html>
<title>Test</title>
<body>
Adapter $st_adapter0$ Sys $sys0$ Freq $ad_freq0$, SR $ad_sr0$, Strength $ad_strength0$ SNR $ad_snr0$ pids=$pids0$<br>
Adapter $st_adapter1$ Sys $sys1$ Freq $ad_freq1$, SR $ad_sr1$, Strength $ad_strength1$ SNR $ad_snr1$ pids=$pids1$<br>
Adapter $st_adapter2$ Sys $sys2$ Freq $ad_freq2$, SR $ad_sr2$, Strength $ad_strength2$ SNR $ad_snr2$ pids=$pids2$<br>
Stream 0 enabled $st_enabled0$ rhost: $st_rhost0$:$st_rport0$ <br>
Stream 1 enabled $st_enabled1$ rhost: $st_rhost1$:$st_rport1$ <br>
Stream 2 enabled $st_enabled2$ rhost: $st_rhost2$:$st_rport2$ <br>
Stream 3 enabled $st_enabled3$ rhost: $st_rhost3$:$st_rport3$ <br>
</body>
</html>
```

**Comment by catalinii** [comment]
Hi 

I need also the log to see what is going on.
The log u sent me does not contain the 404.

404 means it That it could not find a valid adapter, but in your log there are 2 dvb-s2 adapters

**Comment by 9000h** [comment]
with the last changes I was not able to reproduce the issue
