### ISSUE TITLE
ssdp issue

### ISSUE THREAD

**Issue by 9000h** [catalinii/minisatip#161]
there must be a change since ver 0.3.48 which prevents the regular advertisement, so my Panasonic AXW is not detecting the server anymore
I can only see one advertisement at startup with tcpdump
I do not test all commits but 0.3.53 show the issue also

the other issue is a gap of 4 minutes in 0.3.48
```
22:47:29.001396 IP yavdr2.fritz.box.1900 > 239.255.255.250.1900: UDP, length 338
22:47:29.001405 IP yavdr2.fritz.box.1900 > 239.255.255.250.1900: UDP, length 347
22:47:29.002096 IP yavdr2.fritz.box.1900 > 239.255.255.250.1900: UDP, length 372
22:48:29.066627 IP yavdr2.fritz.box.1900 > 239.255.255.250.1900: UDP, length 338
22:48:29.066633 IP yavdr2.fritz.box.1900 > 239.255.255.250.1900: UDP, length 347
22:48:29.067388 IP yavdr2.fritz.box.1900 > 239.255.255.250.1900: UDP, length 372
22:49:29.130006 IP yavdr2.fritz.box.1900 > 239.255.255.250.1900: UDP, length 338
22:49:29.130014 IP yavdr2.fritz.box.1900 > 239.255.255.250.1900: UDP, length 347
22:49:29.130981 IP yavdr2.fritz.box.1900 > 239.255.255.250.1900: UDP, length 372
???
22:52:34.103299 IP yavdr2.fritz.box.1900 > 239.255.255.250.1900: UDP, length 338
22:52:34.103306 IP yavdr2.fritz.box.1900 > 239.255.255.250.1900: UDP, length 347
22:52:34.104188 IP yavdr2.fritz.box.1900 > 239.255.255.250.1900: UDP, length 372
22:53:34.166994 IP yavdr2.fritz.box.1900 > 239.255.255.250.1900: UDP, length 338
22:53:34.167004 IP yavdr2.fritz.box.1900 > 239.255.255.250.1900: UDP, length 347
22:53:34.167008 IP yavdr2.fritz.box.1900 > 239.255.255.250.1900: UDP, length 372
22:54:34.229989 IP yavdr2.fritz.box.1900 > 239.255.255.250.1900: UDP, length 338
22:54:34.229997 IP yavdr2.fritz.box.1900 > 239.255.255.250.1900: UDP, length 347
22:54:34.230773 IP yavdr2.fritz.box.1900 > 239.255.255.250.1900: UDP, length 372
22:56:28.563860 IP yavdr2.fritz.box.1900 > 239.255.255.250.1900: UDP, length 338
22:56:28.563866 IP yavdr2.fritz.box.1900 > 239.255.255.250.1900: UDP, length 347
22:56:28.563869 IP yavdr2.fritz.box.1900 > 239.255.255.250.1900: UDP, length 372
```

**Comment by catalinii** [comment]
Hi,

can you give the entire log ... -l -l -l 

Thanks

**Comment by 9000h** [comment]
you can verify the issue easily by running minisatip with no client interaction on the network, the latest commits will do the advertisement only on start.

**Comment by catalinii** [comment]
Hi,

are you sure is related to the SSDP discovery and not to the ssdp reply ?

The way I see it if there is no 60s SSDP traffic there will be a discovery sent, but this behavior did not changed in the last commits...

Can you please check (if you did not already) if it works with an older commit (0.3.53 and 0.3.56)?

Thanks

**Comment by 9000h** [comment]
as long no SSDP alive is sent by minisatip the Panasonic will not detect the server, from the logs you can see the behavior. The latest stable version for me is 0.3.49 where minisatip did sent out the ssdp periodically as specified in the the specs.

satip_specification_version_1_2_2.pdf
'''
Multicast NOTIFY ssdp:alive messages are sent regularly by all SAT>IP servers in order to signal their continued presence. The refreshing of the NOTIFY advertisement set (consisting of the three messages) has to be done at a randomly-distributed interval of less than one half of the advertisement expiration date (e.g. 900 seconds for a max-age of 1800 seconds). This guarantees that the announcement set is repeated at least twice before it expires
'''

**Comment by 9000h** [comment]
btw if you look in the logs / dump I sent you will see the Pana will not send a discovery if there is no satip ssdp NOTIFY before.

**Comment by 9000h** [comment]
works now as before
